{
  "trip_id": "t_123",
  "style": "documentary",
  "target_s": 60,
  "effective_target_s": 60,
  "context": {
    "destination": {
      "country": "Japan",
      "city": "Kyoto"
    },
    "trip_type": "honeymoon",
    "start_date": "2026-10-12"
  },
  "clips": [
    {
      "moment_id": "m_01",
      "source": "ai",
      "event_type": "scenery",
      "description": "River winding between green hills",
      "score": 0.78,
      "t_from_ms": 120000,
      "duration_s": 32.0,
      "has_audio": false,
      "proposed_in_s": 12.5,
      "proposed_out_s": 19.5,
      "low_fps_lead_in_s": 0
    },
    {
      "moment_id": "m_02",
      "source": "ai",
      "event_type": "landmark",
      "description": "Red torii gates lining a stone path",
      "score": 0.86,
      "t_from_ms": 600000,
      "duration_s": 32.0,
      "has_audio": false,
      "proposed_in_s": 12.5,
      "proposed_out_s": 19.5,
      "low_fps_lead_in_s": 0
    },
    {
      "moment_id": "m_03",
      "source": "button",
      "event_type": "activity",
      "description": "Two people walking under paper lanterns",
      "score": 0.71,
      "t_from_ms": 1500000,
      "duration_s": 31.0,
      "has_audio": false,
      "proposed_in_s": 11.5,
      "proposed_out_s": 18.5,
      "low_fps_lead_in_s": 15.0
    },
    {
      "moment_id": "m_04",
      "source": "ai",
      "event_type": "food",
      "description": "Bowl of ramen on a wooden counter",
      "score": 0.66,
      "t_from_ms": 2400000,
      "duration_s": 32.0,
      "has_audio": false,
      "proposed_in_s": 12.5,
      "proposed_out_s": 19.5,
      "low_fps_lead_in_s": 0
    },
    {
      "moment_id": "m_05",
      "source": "ai",
      "event_type": "scenery",
      "description": "River between green hills under cloud",
      "score": 0.69,
      "t_from_ms": 3100000,
      "duration_s": 32.0,
      "has_audio": false,
      "proposed_in_s": 12.5,
      "proposed_out_s": 19.5,
      "low_fps_lead_in_s": 0
    },
    {
      "moment_id": "m_06",
      "source": "button",
      "event_type": null,
      "description": null,
      "score": null,
      "t_from_ms": 3900000,
      "duration_s": 30.0,
      "has_audio": false,
      "proposed_in_s": 11.5,
      "proposed_out_s": 18.5,
      "low_fps_lead_in_s": 15.0
    },
    {
      "moment_id": "m_07",
      "source": "local_fallback",
      "event_type": null,
      "description": null,
      "score": 0.88,
      "t_from_ms": 4500000,
      "duration_s": 32.0,
      "has_audio": false,
      "proposed_in_s": 12.5,
      "proposed_out_s": 19.5,
      "low_fps_lead_in_s": 0
    },
    {
      "moment_id": "m_08",
      "source": "ai",
      "event_type": "landmark",
      "description": "Wooden temple hall on a hillside",
      "score": 0.81,
      "t_from_ms": 5200000,
      "duration_s": 34.0,
      "has_audio": false,
      "proposed_in_s": 13.5,
      "proposed_out_s": 20.5,
      "low_fps_lead_in_s": 0
    },
    {
      "moment_id": "m_09",
      "source": "ai",
      "event_type": "activity",
      "description": "Hands folding paper at a workshop table",
      "score": 0.63,
      "t_from_ms": 6000000,
      "duration_s": 32.0,
      "has_audio": false,
      "proposed_in_s": 12.5,
      "proposed_out_s": 19.5,
      "low_fps_lead_in_s": 0
    },
    {
      "moment_id": "m_10",
      "source": "ai",
      "event_type": "scenery",
      "description": "Bamboo grove with light through the stalks",
      "score": 0.84,
      "t_from_ms": 6900000,
      "duration_s": 32.0,
      "has_audio": false,
      "proposed_in_s": 12.5,
      "proposed_out_s": 19.5,
      "low_fps_lead_in_s": 0
    },
    {
      "moment_id": "m_11",
      "source": "ai",
      "event_type": "social",
      "description": "Two people sharing tea at a low table",
      "score": 0.72,
      "t_from_ms": 7800000,
      "duration_s": 32.0,
      "has_audio": false,
      "proposed_in_s": 12.5,
      "proposed_out_s": 19.5,
      "low_fps_lead_in_s": 0
    },
    {
      "moment_id": "m_12",
      "source": "ai",
      "event_type": "scenery",
      "description": "City lights seen from a hilltop at dusk",
      "score": 0.8,
      "t_from_ms": 8600000,
      "duration_s": 32.0,
      "has_audio": false,
      "proposed_in_s": 12.5,
      "proposed_out_s": 19.5,
      "low_fps_lead_in_s": 0
    }
  ]
}
